{
  "schema_version": "impactu-type-routing-v1",
  "catalog_version": "1.1.0",
  "source": {
    "workbook": "Tipos_ImpactU_Definitivo.xlsx",
    "sha256": "7288727e73be698acaf6ba81799d36d56b37f9265b163a6e9a85f4489c0ecb91",
    "sheets": [
      {
        "name": "ALL",
        "source": "Fuente column",
        "input_rows": 606,
        "mapping_rows": 606,
        "unmapped_rows": 0
      },
      {
        "name": "COAR",
        "source": "coar",
        "input_rows": 109,
        "mapping_rows": 108,
        "unmapped_rows": 1
      },
      {
        "name": "REDCOL",
        "source": "redcol",
        "input_rows": 61,
        "mapping_rows": 61,
        "unmapped_rows": 0
      },
      {
        "name": "INFO-EU-REPO",
        "source": "eu-repo",
        "input_rows": 31,
        "mapping_rows": 25,
        "unmapped_rows": 1
      }
    ],
    "input_rows": 807,
    "rows": 800,
    "duplicates_removed": 5,
    "unmapped_rows": 2
  },
  "entities": [
    "events",
    "patents",
    "projects",
    "works"
  ],
  "impactu_types": [
    "Artículo de revista",
    "Audiovisual",
    "Capítulo de libro",
    "Conjunto de datos",
    "Código fuente",
    "Documento de trabajo",
    "Documento legal",
    "Evento",
    "Informe",
    "Innovación y apropiación",
    "Investigación-creación",
    "Libro",
    "Material cartográfico",
    "Modelo",
    "Norma",
    "Otro",
    "Patente",
    "Producción artística",
    "Programa de curso",
    "Proyecto",
    "Publicaciones editoriales no especializadas",
    "Recursos electrónicos",
    "Resultado de conferencia",
    "Secuencia genética",
    "Tesis de posgrado",
    "Tesis de pregrado",
    "Variedad animal",
    "Variedad vegetal",
    "Variedad vegetal o animal"
  ],
  "mappings": [
    {
      "source": "ciarp_udea",
      "type": "Articulo corto publicado en libro de texto",
      "type_impactu": "Capítulo de libro",
      "entity": "works"
    },
    {
      "source": "ciarp_udea",
      "type": "Articulo corto publicado en libro resultado de investigacion",
      "type_impactu": "Capítulo de libro",
      "entity": "works"
    },
    {
      "source": "ciarp_udea",
      "type": "Articulo corto publicado en revista Tipo A1",
      "type_impactu": "Artículo de revista",
      "entity": "works"
    },
    {
      "source": "ciarp_udea",
      "type": "Articulo corto publicado en revista Tipo A2",
      "type_impactu": "Artículo de revista",
      "entity": "works"
    },
    {
      "source": "ciarp_udea",
      "type": "Articulo corto publicado en revista Tipo B1",
      "type_impactu": "Artículo de revista",
      "entity": "works"
    },
    {
      "source": "ciarp_udea",
      "type": "Articulo corto publicado en revista Tipo C1",
      "type_impactu": "Artículo de revista",
      "entity": "works"
    },
    {
      "source": "ciarp_udea",
      "type": "Articulo en revista de difusion internacional. Categoria A",
      "type_impactu": "Artículo de revista",
      "entity": "works"
    },
    {
      "source": "ciarp_udea",
      "type": "Articulo en revista nacional de difusion local",
      "type_impactu": "Artículo de revista",
      "entity": "works"
    },
    {
      "source": "ciarp_udea",
      "type": "Articulo en revista nacional de difusion nacional",
      "type_impactu": "Artículo de revista",
      "entity": "works"
    },
    {
      "source": "ciarp_udea",
      "type": "Articulo en revista Tipo A1",
      "type_impactu": "Artículo de revista",
      "entity": "works"
    },
    {
      "source": "ciarp_udea",
      "type": "Articulo en revista Tipo A2",
      "type_impactu": "Artículo de revista",
      "entity": "works"
    },
    {
      "source": "ciarp_udea",
      "type": "Articulo en revista Tipo B",
      "type_impactu": "Artículo de revista",
      "entity": "works"
    },
    {
      "source": "ciarp_udea",
      "type": "Articulo en revista Tipo B2",
      "type_impactu": "Artículo de revista",
      "entity": "works"
    },
    {
      "source": "ciarp_udea",
      "type": "Articulo en revista Tipo C",
      "type_impactu": "Artículo de revista",
      "entity": "works"
    },
    {
      "source": "ciarp_udea",
      "type": "Articulos nacionales publicados ante del 28/03/2003",
      "type_impactu": "Artículo de revista",
      "entity": "works"
    },
    {
      "source": "ciarp_udea",
      "type": "Capitulo de libro de ensayo",
      "type_impactu": "Capítulo de libro",
      "entity": "works"
    },
    {
      "source": "ciarp_udea",
      "type": "Capitulo de libro de texto",
      "type_impactu": "Capítulo de libro",
      "entity": "works"
    },
    {
      "source": "ciarp_udea",
      "type": "Capitulo de libro resultado de investigacion",
      "type_impactu": "Capítulo de libro",
      "entity": "works"
    },
    {
      "source": "ciarp_udea",
      "type": "Capitulo de libro Tipo B",
      "type_impactu": "Capítulo de libro",
      "entity": "works"
    },
    {
      "source": "ciarp_udea",
      "type": "Capitulo de obra artistica",
      "type_impactu": "Capítulo de libro",
      "entity": "works"
    },
    {
      "source": "ciarp_udea",
      "type": "Capitulo de obra artistica nacional",
      "type_impactu": "Capítulo de libro",
      "entity": "works"
    },
    {
      "source": "ciarp_udea",
      "type": "Carta al editor en revista tipo A1",
      "type_impactu": "Artículo de revista",
      "entity": "works"
    },
    {
      "source": "ciarp_udea",
      "type": "Carta al editor en revista tipo A2",
      "type_impactu": "Artículo de revista",
      "entity": "works"
    },
    {
      "source": "ciarp_udea",
      "type": "Carta al editor en revista tipo B",
      "type_impactu": "Artículo de revista",
      "entity": "works"
    },
    {
      "source": "ciarp_udea",
      "type": "Carta al editor en revista tipo C",
      "type_impactu": "Artículo de revista",
      "entity": "works"
    },
    {
      "source": "ciarp_udea",
      "type": "Composicion musica de camara nacional",
      "type_impactu": "Producción artística",
      "entity": "works"
    },
    {
      "source": "ciarp_udea",
      "type": "Composicion musical musica de camara",
      "type_impactu": "Producción artística",
      "entity": "works"
    },
    {
      "source": "ciarp_udea",
      "type": "Comunicacion corta en revista Tipo A1",
      "type_impactu": "Artículo de revista",
      "entity": "works"
    },
    {
      "source": "ciarp_udea",
      "type": "Comunicacion corta en revista Tipo A2",
      "type_impactu": "Artículo de revista",
      "entity": "works"
    },
    {
      "source": "ciarp_udea",
      "type": "Comunicacion corta en revista Tipo B",
      "type_impactu": "Artículo de revista",
      "entity": "works"
    },
    {
      "source": "ciarp_udea",
      "type": "Comunicacion corta en revista Tipo C",
      "type_impactu": "Artículo de revista",
      "entity": "works"
    },
    {
      "source": "ciarp_udea",
      "type": "Cuento o relato de difusion nacional",
      "type_impactu": "Publicaciones editoriales no especializadas",
      "entity": "works"
    },
    {
      "source": "ciarp_udea",
      "type": "Direccion de trabajo de grado de doctorado",
      "type_impactu": "Tesis de posgrado",
      "entity": "works"
    },
    {
      "source": "ciarp_udea",
      "type": "Direccion de trabajo de grado de especializacion medica()",
      "type_impactu": "Tesis de posgrado",
      "entity": "works"
    },
    {
      "source": "ciarp_udea",
      "type": "Direccion de trabajo de grado de maestria",
      "type_impactu": "Tesis de posgrado",
      "entity": "works"
    },
    {
      "source": "ciarp_udea",
      "type": "Director de actores en obra de teatro",
      "type_impactu": "Producción artística",
      "entity": "works"
    },
    {
      "source": "ciarp_udea",
      "type": "Editorial en revista tipo A1",
      "type_impactu": "Artículo de revista",
      "entity": "works"
    },
    {
      "source": "ciarp_udea",
      "type": "Editorial en revista tipo A2",
      "type_impactu": "Artículo de revista",
      "entity": "works"
    },
    {
      "source": "ciarp_udea",
      "type": "Editorial en revista tipo B",
      "type_impactu": "Artículo de revista",
      "entity": "works"
    },
    {
      "source": "ciarp_udea",
      "type": "Editorial en revista tipo C",
      "type_impactu": "Artículo de revista",
      "entity": "works"
    },
    {
      "source": "ciarp_udea",
      "type": "Estidio posdoctoral",
      "type_impactu": "Tesis de posgrado",
      "entity": "works"
    },
    {
      "source": "ciarp_udea",
      "type": "Impreso universitario",
      "type_impactu": "Publicaciones editoriales no especializadas",
      "entity": "works"
    },
    {
      "source": "ciarp_udea",
      "type": "Interpretacion de impacto internacional",
      "type_impactu": "Producción artística",
      "entity": "works"
    },
    {
      "source": "ciarp_udea",
      "type": "Interpretacion de impacto local",
      "type_impactu": "Producción artística",
      "entity": "works"
    },
    {
      "source": "ciarp_udea",
      "type": "Interpretacion de impacto nacional",
      "type_impactu": "Producción artística",
      "entity": "works"
    },
    {
      "source": "ciarp_udea",
      "type": "Libro de ensayo",
      "type_impactu": "Libro",
      "entity": "works"
    },
    {
      "source": "ciarp_udea",
      "type": "Libro de ensayo por capitulos",
      "type_impactu": "Libro",
      "entity": "works"
    },
    {
      "source": "ciarp_udea",
      "type": "Libro de investigacion por capitulos resolucion 01 14/03/2018",
      "type_impactu": "Libro",
      "entity": "works"
    },
    {
      "source": "ciarp_udea",
      "type": "Libro de literatura categoria A",
      "type_impactu": "Libro",
      "entity": "works"
    },
    {
      "source": "ciarp_udea",
      "type": "Libro de texto",
      "type_impactu": "Libro",
      "entity": "works"
    },